{
  "schema_version": "0.1.0",
  "contract": "gripper.open",
  "version": "1.0.0",
  "description": "Open the reusable parallel gripper at the requested manipulation step.",
  "request_schema": {"type": "object"},
  "result_schema": {"type": "object", "required": ["jaw_state"]},
  "fault_catalog": "../fault_catalogs/kitting.faults.json",
  "supports_cancellation": true,
  "timeout_required": true
}
