{
  "schema_version": "0.1.0",
  "contract": "fixture.verify_seated",
  "version": "1.0.0",
  "description": "Verify the kit tray seating signal before release.",
  "request_schema": {"type": "object"},
  "result_schema": {"type": "object", "required": ["seated"]},
  "fault_catalog": "../fault_catalogs/kitting.faults.json",
  "supports_cancellation": true,
  "timeout_required": true
}
